{
  "schemaVersion": "1.0",
  "runId": "run-001",
  "taskId": "task-001",
  "experiment": null,
  "modelResolved": "scripted-fake-draft-v1",
  "harnessVersion": "framework-free-agent-kernel-v1",
  "componentVersions": {
    "agent": "agent-draft-service-v1",
    "verifier": "agent-draft-verifier-v1",
    "trace-integrity": "emergeos-length-prefixed-sha256-v1"
  },
  "environmentSnapshotRef": null,
  "toolRegistryVersion": "agent-tools-v1",
  "task": {
    "schemaVersion": "1.0",
    "id": "task-001",
    "parentId": null,
    "principalRef": "owner-001",
    "delegationChain": [],
    "kind": "CREATE_ARTICLE_DRAFT",
    "intent": "Create one safe synthetic draft",
    "inputRefs": ["capture://capture-001"],
    "evidenceRefs": [],
    "modalities": ["text"],
    "dataClass": "PERSONAL",
    "risk": "REVERSIBLE",
    "latencyClass": "INTERACTIVE",
    "requiredTools": ["capture.read"],
    "outputSchema": "urn:emergeos:schema:internal:agent-draft-proposal:v1",
    "acceptanceChecks": ["uses owned evidence"],
    "allowParallel": false,
    "maxModelSteps": 2,
    "maxToolCalls": 1,
    "deadlineMs": 5000,
    "budgetUsd": 0,
    "idempotencyKey": null,
    "policyVersion": "agent-draft-policy-v1",
    "stateVersion": "stage2-s2",
    "contextPolicyVersion": "ref-only-v1",
    "toolRegistryVersion": "agent-tools-v1",
    "environmentSnapshotRef": null,
    "capabilityRefs": [],
    "unresolvedDecisions": [],
    "returnControlWhen": "structured final or non-success"
  },
  "result": {
    "schemaVersion": "1.0",
    "runId": "run-001",
    "taskId": "task-001",
    "status": "SUCCEEDED",
    "artifactRefs": ["artifact-version://artifact-001/1"],
    "evidenceRefs": ["capture://capture-001"],
    "claims": [],
    "uncertainty": [],
    "receiptRefs": [],
    "resolvedModel": "scripted-fake-draft-v1",
    "agentVersion": "agent-draft-service-v1",
    "verifierVersion": "agent-draft-verifier-v1",
    "costUsd": 0,
    "tokenCount": 0,
    "latencyMs": 25,
    "traceRef": "/api/v1/agent-runs/run-001/trace",
    "failureReason": null
  },
  "workingSelfRef": null,
  "traceRef": "/api/v1/agent-runs/run-001/trace",
  "traceRootHash": "562d525968b172060ab312ea39c0523dd7be03b89fa30088176a7e4e2bb5fbe7",
  "handoffRefs": [],
  "checkpointRefs": [],
  "resourceBindings": [
    {
      "role": "EVIDENCE",
      "ordinal": 0,
      "ref": "capture://capture-001",
      "contentHash": "1111111111111111111111111111111111111111111111111111111111111111"
    },
    {
      "role": "ARTIFACT",
      "ordinal": 0,
      "ref": "artifact-version://artifact-001/1",
      "contentHash": "2222222222222222222222222222222222222222222222222222222222222222"
    }
  ],
  "verificationRef": null,
  "failureAttribution": null,
  "outcome": "SUCCEEDED",
  "costUsd": 0,
  "tokenCount": 0,
  "latencyMs": 25,
  "integrityProfile": "emergeos-length-prefixed-sha256-v1",
  "integrityHash": "58f245058fa868099468b8ae4f7b435b8587a5237ae64422b7524e60d8ffe828"
}
