{
  "schemaVersion": "1.1",
  "runId": "run-model-bound",
  "taskId": "task-model-bound",
  "experiment": {
    "arm": "openai-responses-h0",
    "repetition": 1
  },
  "modelResolved": "gpt-5.6-sol-2026-07-15",
  "harnessVersion": "framework-free-agent-kernel-v2",
  "componentVersions": {
    "agent": "agent-v1",
    "verifier": "verifier-v1",
    "trace-integrity": "emergeos-length-prefixed-sha256-v1",
    "model-adapter": "openai-responses-v1-openai-java-4.43.0"
  },
  "environmentSnapshotRef": "environment://sha256:aaaaaaaaaaaaaaaaaaaaaaaaaaaaaaaaaaaaaaaaaaaaaaaaaaaaaaaaaaaaaaaa",
  "toolRegistryVersion": "agent-tools-v1",
  "task": {
    "schemaVersion": "1.1",
    "id": "task-model-bound",
    "parentId": null,
    "principalRef": "synthetic-eval-owner",
    "delegationChain": [],
    "kind": "MODEL_EVAL",
    "intent": "Evaluate one frozen synthetic prompt",
    "inputRefs": ["capture://synthetic-model-eval"],
    "evidenceRefs": [],
    "modalities": ["text"],
    "dataClass": "PUBLIC",
    "risk": "READ_ONLY",
    "latencyClass": "INTERACTIVE",
    "requiredTools": ["capture.read"],
    "outputSchema": "urn:emergeos:schema:internal:agent-draft-proposal:v1",
    "acceptanceChecks": ["uses only frozen synthetic evidence"],
    "allowParallel": false,
    "maxModelSteps": 2,
    "maxToolCalls": 1,
    "deadlineMs": 30000,
    "budgetUsd": 0.01,
    "modelProvider": "openai.responses",
    "modelRequested": "gpt-5.6-sol",
    "pricingProfile": "openai-gpt-5.6-sol-2026-07-v1",
    "idempotencyKey": "synthetic-openai-eval-001",
    "policyVersion": "synthetic-model-egress-policy-v1",
    "stateVersion": "stage2-s3",
    "contextPolicyVersion": "ref-only-v1",
    "toolRegistryVersion": "agent-tools-v1",
    "environmentSnapshotRef": "environment://sha256:aaaaaaaaaaaaaaaaaaaaaaaaaaaaaaaaaaaaaaaaaaaaaaaaaaaaaaaaaaaaaaaa",
    "capabilityRefs": ["capability://model-egress/synthetic-openai-v1"],
    "unresolvedDecisions": [],
    "returnControlWhen": "structured final or non-success"
  },
  "result": {
    "schemaVersion": "1.0",
    "runId": "run-model-bound",
    "taskId": "task-model-bound",
    "status": "FAILED",
    "artifactRefs": [],
    "evidenceRefs": [],
    "claims": [],
    "uncertainty": [],
    "receiptRefs": [],
    "resolvedModel": "gpt-5.6-sol-2026-07-15",
    "agentVersion": "agent-v1",
    "verifierVersion": "verifier-v1",
    "costUsd": 0.001,
    "tokenCount": 100,
    "latencyMs": 100,
    "traceRef": "/api/v1/agent-runs/run-model-bound/trace",
    "failureReason": "MODEL_RATE_LIMITED"
  },
  "workingSelfRef": null,
  "traceRef": "/api/v1/agent-runs/run-model-bound/trace",
  "traceRootHash": "1e689944b93c8523a09a2fc92b76edfd58adfe5864d2a9b68c72e4043ab9b79f",
  "handoffRefs": [],
  "checkpointRefs": [],
  "resourceBindings": [],
  "verificationRef": null,
  "failureAttribution": "MODEL_RATE_LIMITED",
  "outcome": "FAILED",
  "costUsd": 0.001,
  "tokenCount": 100,
  "latencyMs": 100,
  "integrityProfile": "emergeos-length-prefixed-sha256-v1",
  "integrityHash": "773f5a980a8feb67e5029ecdcbf17bd2220aa938ef4f53034af6a593a8c6c8e2"
}
